Programme=[Retail],Distributor View=[Manufacturing],View By=[ASIN],Countries=[IN],Businesses=[CAMBIUM RETAIL PRIVATE LIMITED - PC - MH - CRPL;Cambium Retail Pvt. Lt. - Mumbai - cb;Cambium Retail Pvt. Ltd.-MH],Locale=[en_IN],Currency=[INR],Reporting Range=[Custom],Viewing Range=[01/01/26 - 31/01/26],Brands=[7G03N],Report Updated=[23/03/26],
SKU,Model,ASIN,Product Title,Brand,Store Code,Ordered Revenue,Ordered Units,Shipped Revenue,Shipped COGS,Shipped Units,Customer Returns
FBA76864,AI-04 Red,B0BPLZ5CGV,Audio Array AI-04 2x2 Gen 3 Audio Interface | Premium Mic Pre-Amps | 48V Phantom Power Support | 24bit/192kHz High Fidelity Recording | XLR/MIC/LINE inputs | Plug & Play-No Drivers | Metal Body | Red,Audio Array,IN,"₹ 21,87,883.22",548,₹ 0.00,₹ 0.00,535,163
FBA75673,AM-C1,B0B4DPX2J2,"Audio Array AM-C1 USB Condenser Microphone Kit | for Podcasting, Online Meeting, Gaming, Singing & Live Streaming | Boom Arm, Pop Filter, Mic Cover, Spider Shock Mount, Tripod & 2.5M USB Cable",Audio Array,IN,"₹ 17,22,134.01",771,₹ 0.00,₹ 0.00,760,162
FBA79482,AM-S1,B0DXFPM4N2,"Audio Array AM-S1 BT v5.3 |Professional 4"" Studio Monitor Speaker Pair| 60W Class D Amplification,Woven Composite Woofer,1"" Silk-Dome Tweeter,EQ Controls|Music/Monitor Mode, Aux, HDMI, USB C, TRS, RCA",Audio Array,IN,"₹ 9,74,092.58",132,₹ 0.00,₹ 0.00,134,47
FBA79380,AM-C46,B0D3M1B4Z8,"Audio Array AM-C46 Professional RGB USB Condenser Microphone Kit | Noise-Cancellation, Mute, Monitoring & Volume Controls | 192kHz/24bit Studio Quality | Gaming, Streaming, Podcast | Mac/PC/Mobile",Audio Array,IN,"₹ 4,50,986.58",151,₹ 0.00,₹ 0.00,145,25
FBA79813,AH-50,B0FG88HVQ8,"Audio Array AH-50 Professional DJ Headphone | 50mm Drivers | 32Ω | 20Hz-20kHz | Dual Detachable Cables With Mic & Controls | Buddy Share Technology | 105 dB SPL | One Ear Listening | Monitoring,Mixing",Audio Array,IN,"₹ 4,26,905.04",252,₹ 0.00,₹ 0.00,246,38
FBA79005,AM-W45,B0CKHVHVQ1,"Audio Array AM-W45 Wireless Conference Microphone with Speaker | Bluetooth, USB & 4 Mics | 360° Pickup Upto 4M | Noise Reduction & Enhanced Voice | Portable Speakerphone for Video Calls/Zoom Meeting",Audio Array,IN,"₹ 2,63,422.87",61,₹ 0.00,₹ 0.00,61,4
FBA79961,AI-13,B0G53H49BS,"Audio Array AI-13 2026 Edition 4-Channel Hybrid USB Summing Mixer 4 Analog+2 Digital, 48kHz/16-Bit, 2XLR Mic Inputs,TRS Stereo In, 48V Phantom, Hi-Z,2 Band EQ,Monitoring,Amp Out, USB-C Power",Audio Array,IN,"₹ 2,53,889.01",111,₹ 0.00,₹ 0.00,110,14
FBA78975,AA-21,B0CF5TCQKL,"Audio Array AA-21 Desktop Mount Speaker Stands | 15KG Capacity | Height, Tilt & Rotation Adjustable | Smart Cable Management | for Sound Editing, Gaming, Music Production | Black (Set of 2)",Audio Array,IN,"₹ 2,10,123.79",67,₹ 0.00,₹ 0.00,65,11
FBA79103,AI-10,B0CM6NTWBP,"Audio Array AI-10 Professional Live Soundcard|1Ch Mixer |Bluetooth | 3 Condenser Mic Inputs, 2 mobilephones & PC/Mac Outputs | +48V phantom power, 4 Voice Modes, Denoise, built-in FX | Gaming, Karaoke",Audio Array,IN,"₹ 1,89,878.46",75,₹ 0.00,₹ 0.00,79,30
FBA79109,AM-W18,B0CM9HYVDM,"Audio Array AM-W18 Wireless Karaoke Speaker with Microphone | Portable Bluetooth Speaker for Singing & Gifting with Voice Changer | Upto 8+ Hours of Playback | Bluetooth v5.3, SD Card & AUX in (Pink)",Audio Array,IN,"₹ 1,78,088.84",176,₹ 0.00,₹ 0.00,178,16
FBA79011,AM-C43,B0CH4RNWJX,"Audio Array AM-C43 XLR to 3.5mm Professional Condenser Microphone Kit | Boom Arm, 2M Cable & Foam Filter | Compatible with Audio Interface, Mixer | Recording, Podcast, Streaming, Home Studio (Black)",Audio Array,IN,"₹ 1,71,427.32",81,₹ 0.00,₹ 0.00,85,24
FBA78973,AA-19,B0CF5R3V95,"Audio Array AA-19 2in1 High & Low Profile Mic Stand | 71cm reach | Premium Metal design with Built In Cable Management | Flexible Position adjustments | 2Kg Weight Capacity |5/8"" to 3/8"" Screw Adapter",Audio Array,IN,"₹ 1,64,178.86",51,₹ 0.00,₹ 0.00,55,8
FBA79838,AH-40 SL,B0FQBX8J17,"Audio Array AH-40-SL Wired Over-Ear Headphones | 40mm Drivers, 15-22KHz, 32Ω, 105dB SPL Sound, Studio Monitoring, Gaming, Live Music Headset with 3.5mm + 6.3mm Plug Compatibility",Audio Array,IN,"₹ 1,41,237.90",139,₹ 0.00,₹ 0.00,136,14
FBA75674,AM-C2,B0B4G19R58,"Audio Array AM-C2 XLR Condenser Microphone Kit | Boom Arm, 2M Cable, Pop Filter & Mic Cover | Compatible with Audio Interface, Mixer & preamp | Recording, Podcasting, Streaming, Home Studio (Black)",Audio Array,IN,"₹ 1,35,090.78",41,₹ 0.00,₹ 0.00,42,10
FBA79839,AH-45 BK,B0FQBXS6Y2,"Audio Array AH-45-BK Studio Monitoring & Live Recording Headphones | 20-20KHz, 32 Ω, 100dB SPL | 40mm Depp Bass Closed-Back Driver | 3m OFC Cable | 3.5mm + 6.3mm Adapter (Black)",Audio Array,IN,"₹ 1,27,333.06",97,₹ 0.00,₹ 0.00,94,20
FBA79821,"UB-01 (AI-04, AM-S1, AA-21, AM-C2)",B0FJ2JJZL3,"Audio Array Professional Studio Bundle with 24-Bit/192kHz Audio Interface, 4"" Studio Monitors, Condenser Mic & Stands | for Music Production, Podcasting, Dubbing, Recording & Audio Mixing - UB-01",Audio Array,IN,"₹ 1,17,365.28",7,₹ 0.00,₹ 0.00,7,1
FBA76862,AM-C28,B0BPLWW72Y,Audio Array AM-C28 USB Plug & Play Conference Microphone | Omni Directional Pickup Upto 3M | Mic Mute Button | No Drivers Condenser USB Type-C | Ideal for Meetings & Video Calling (Not a Speaker),Audio Array,IN,"₹ 1,07,610.93",82,₹ 0.00,₹ 0.00,80,14
FBA79449,AM-W36,B0DFMNGFTD,"Audio Array AM-W36 UHF Dual Wireless Premium Metal Microphone with Charging | 2X XLR Outs & 1/4"" Mix Out | 328ft/100M Range | Karaoke Singing, Wedding, Events | PA System, Amplifier, Mixer, Party Box",Audio Array,IN,"₹ 1,03,664.40",20,₹ 0.00,₹ 0.00,20,8
FBA79104,AI-11,B0CM6NVLT9,"Audio Array AI-11 USB Bluetooth Soundcard, 1Ch Mixer, Audio Interface | 2 Condenser In, 2 Out |2 Live Out+1 Accompany In | OTG for mobile and PC/MAC | Effects | Streaming, Podcasting, Gaming, Singing",Audio Array,IN,"₹ 96,678.07",75,₹ 0.00,₹ 0.00,75,19
FBA76414,AA-05,B0BLJVJ2GN,"Audio Array AA-05 Suspension Boom Scissor Microphone Arm Stand | Universal clamp with mic Holder & 3/8″ to 5/8″ Adapter for Shock mounts | Suitable for Stages, Studios, Broadcasting, TV Stations",Audio Array,IN,"₹ 95,700.00",174,₹ 0.00,₹ 0.00,178,19
FBA75690,AM-C10,B0B4K87PR4,Audio Array AM-C10 USB Plug & Play Conference Microphone with Speaker | Omni Directional Pickup Upto 4M | Speaker and Mic Mute Buttons | Volume Control & Mute Button | Ideal for Meeting & Video Call,Audio Array,IN,"₹ 84,463.49",25,₹ 0.00,₹ 0.00,25,1
FBA79816,AM-W22,B0FPR962YS,"Audio Array AM-W22 | Latest 2026 Edition Wireless Microphone for Camera/iPhone/Android/iPad/Laptop, Lav Mic with Charging Case, AI Noise Reduction, 50H Battery, 230ft Range, for Recording, YouTube",Audio Array,IN,"₹ 84,450.52",32,₹ 0.00,₹ 0.00,31,4
FBA79654,AM-C11 Pro,B0DN6MNS1X,"Audio Array AM-C11 Pro XLR/USB Professional Dynamic Mic Kit | Premium Metal 96kHz/24bit Studio Quality | 2M XLR & USB Cables,Volume Control,Mute & Realtime Monitoring | Streaming,Gaming & podcasting",Audio Array,IN,"₹ 76,255.92",18,₹ 0.00,₹ 0.00,18,4
FBA79694,AA-26,B0DT6T6N6B,"Audio Array AA-26 Tabletop Metal Microphone Stand | Extendable height up to 22cm | Studio Sound Recording, Streaming, Podcasting, Singing | Stylish Sturdy Metal Design to last long, flat base",Audio Array,IN,"₹ 73,044.69",157,₹ 0.00,₹ 0.00,154,25
FBA79355,AA-19BL,B0D3M86SH1,Audio Array AA-19BL RGB Low Profile Boomarm Stand with Riser | 71cm reach & 20 RGB lighting effects & Built-In Cable Management | Matte finish with Flexible adjustments | 2Kg Weight Capacity | Black,Audio Array,IN,"₹ 70,284.71",17,₹ 0.00,₹ 0.00,17,4
FBA75679,AA-02,B0B4JRQP22,"Audio Array AA-02 3-Panel Curved Isolation Shield with Insulation, Absorption & Reflection Filter | 3/8"" and 5/8"" Universal Mic Mount for Recording Studio, Podcasts, Singing & Broadcasting",Audio Array,IN,"₹ 67,754.26",32,₹ 0.00,₹ 0.00,31,4
FBA75677,AM-C5,B0B4KC7VBM,"Audio Array AM-C5 USB Plug & Play Conference Mic for Mac OS & Windows | Conference, Recording, Skype, Online Class with Range Upto 5M | One Touch Mute Button & Light Indicator (NOT A Speaker)",Audio Array,IN,"₹ 67,323.79",34,₹ 0.00,₹ 0.00,34,7
FBA79906,PB-12 (AM-C11+AA-05+AI-04+AH-60-RD),B0FTVVLNS9,"Audio Array Professional Dynamic Bundle with Headphones & Audio Interface - USB/XLR Dynamic Microphone, 24-bit/192kHz Interface, Boom Arm & Semi-Open Headphones | Plug & Play Podcast Kit - PB-12",Audio Array,IN,"₹ 60,067.80",6,₹ 0.00,₹ 0.00,6,1
FBA79827,PB-03 (AI-04 Red + AM-C11 x 2),B0FJ8S5XJ8,"Audio Array Complete Podcast Bundle | Dual USB/XLR Dynamic Microphones with Audio Interface 24bit / 192kHz|Metal Body|Pro Streaming & Recording Kit for PC, Mac & Mobile - PB-03",Audio Array,IN,"₹ 59,317.80",5,₹ 0.00,₹ 0.00,6,5
FBA78960,AM-C39,B0CBCB82MT,"Audio Array AM-C39 XLR to 3.5mm Condenser Microphone Kit | Tripod, 2M Cable & Foam Filter | Compatible with Audio Interface, Mixer | Recording, Podcast, Streaming, Home Studio (Black)",Audio Array,IN,"₹ 58,701.77",42,₹ 0.00,₹ 0.00,43,20
FBA79445,AM-W32,B0DFMLS8JG,"Audio Array AM-W32 UHF Dual Wireless Metal Microphones | Built-in Rechargeable Battery | 6–8 Hours Backup | 60M Range | Karaoke, DJ, Events, PA System | Echo & Volume Controls",Audio Array,IN,"₹ 58,270.11",20,₹ 0.00,₹ 0.00,20,2
FBA79106,AM-C44,B0CM9KJZWQ,"Audio Array AM-C44 XLR/USB Professional Dynamic Podcast Microphone | Built-in Monitoring | One Touch Mute & Volume Control | 192kHz/24bit Full Metal Build | 2M XLR & USB Cable | Streaming, Podcasting",Audio Array,IN,"₹ 54,720.32",14,₹ 0.00,₹ 0.00,15,3
FBA79379,AM-C45,B0D3LZWTHV,"Audio Array AM-C45 XLR/USB Professional RGB Dynamic Podcast Microphone | Built-in Monitoring | One Touch Mute Volume & Noise-Cancellation | 2M USB Cable & Metal Base | Streaming, Podcasting, Singing",Audio Array,IN,"₹ 50,402.54",17,₹ 0.00,₹ 0.00,15,3
FBA79969,UB-03 (AM-S1 + AA-22),B0G3B677Z5,"Audio Array Studio Monitor Bundle with 60W Powered Speakers & Adjustable Metal Stands | Bluetooth, HDMI ARC, USB-C, RCA Inputs | Professional Studio Monitors for Home Studio, Streaming & Gaming-UB-03",Audio Array,IN,"₹ 48,383.92",5,₹ 0.00,₹ 0.00,5,1
FBA75684,AA-04,B0B4G7VWXD,"Audio Array AA-04 Metal Spider Shock Mount for Condenser Microphone | Anti Vibration, Suspension, Isolation | 4 Size Bottom Screws & Extra Replacement Elastic Bands | Recommended For Rode, Samson, etc",Audio Array,IN,"₹ 47,917.85",34,₹ 0.00,₹ 0.00,35,12
FBA77171,AC-6XL,B0CH4VCD6R,"Audio Array AC-6XL Mic Cable 6.35mm Jack Male to XLR 3PIN Female Cord Wire | Microphone/Guitar Cable | Black, 1pc Pack (6 Meter/19.6 Feet)",Audio Array,IN,"₹ 44,627.13",94,₹ 0.00,₹ 0.00,93,10
FBA78976,AA-22,B0CF5SHL15,"Audio Array AA-22 Desktop Mount Speaker Stands | 15KG Capacity | Height, Tilt & Rotation Adjustable | Smart Cable Management | for Sound Editing, Gaming, Music Production | Red (Set of 2)",Audio Array,IN,"₹ 40,751.68",13,₹ 0.00,₹ 0.00,12,2
FBA79655,AM-C44 Pro,B0DN6PFWNK,Audio Array AM-C44 Pro XLR/USB Professional Dynamic Microphone Kit | Built-in Monitoring | One Touch Mute & Volume Control | 192kHz/24bit Full Metal Build | 2M XLR & USB Cable | Streaming & Podcasting,Audio Array,IN,"₹ 39,822.87",9,₹ 0.00,₹ 0.00,7,1
FBA79845,UB-02 (AM-S1 + AA-21),B0FN7B3KWS,"Audio Array Studio Monitor Bundle with 60W Powered Speakers & Adjustable Metal Stands | Bluetooth, HDMI ARC, USB-C, RCA Inputs | Professional Studio Monitors for Home Studio, Streaming & Gaming-UB-02",Audio Array,IN,"₹ 39,318.64",4,₹ 0.00,₹ 0.00,4,
FBA79964,AM-Pro12,B0G53KWRWH,"Audio Array AM-Pro12 12-Channel HYBRID USB Mixer 12 channel analog+2 digital 48kHz/16bit,128DSP Fx, Built-In Compressor, 4Group Buses, Inserts,+24dBu Balanced XLR Outs For Live, Studio & Broadcast",Audio Array,IN,"₹ 38,981.36",2,₹ 0.00,₹ 0.00,2,
FBA79823,PB-01 (AM-C11 + AI-04),B0FJ2HZCVN,"Audio Array Ultimate Podcast Bundle | Dynamic Microphone with USB/XLR Connectivity & 24-Bit/192kHz Audio Interface | Ideal for Podcasting, Streaming, Voice Recording & Content Creation - PB-01",Audio Array,IN,"₹ 37,771.78",5,₹ 0.00,₹ 0.00,5,1
FBA78925,AM-C11X,B0CBC7QMNV,"Audio Array AM-C11X XLR Dynamic Microphone | Studio-quality Audio Output | Cardioid Polar Pattern | Premium Metal Build | 2 Meter XLR cable | for Streaming, Gaming, Podcasting, Singing | 2 Yr Warranty",Audio Array,IN,"₹ 36,716.10",12,₹ 0.00,₹ 0.00,12,
FBA75675,AM-C3,B0B4G8ZB64,"Audio Array AM-C3 XLR to TRS Dynamic Handheld Karaoke Microphone | Premium Metal Built with 3M Cable | Singing, Public Meetings, Studio Recording, Live Show, Party, Church, Wedding",Audio Array,IN,"₹ 35,210.89",46,₹ 0.00,₹ 0.00,44,7
FBA75688,AM-W12,B0B4G763WS,"Audio Array AM-W12 UHF Dual Wireless Premium Metal Microphones | 4+ Hours Receiver Battery Backup | Range up to 60m| Karaoke Singing, Wedding, DJ, Church | PA System, Amplifier, Mixer, Party Box, etc",Audio Array,IN,"₹ 33,831.35",10,₹ 0.00,₹ 0.00,10,2
FBA79841,AH-60 BL,B0FQBTRM28,"Audio Array AH-60-BL, 60Ω, Professional Monitoring Headphones | 53mm Drivers | 10Hz–30KHz | 105dB SPL | Closed-Back, DJ & Studio | 3m Cable with 3.5mm & 6.3mm Plugs (Blue)",Audio Array,IN,"₹ 33,193.28",20,₹ 0.00,₹ 0.00,20,7
FBA79968,AI-14,B0G53M9258,"Audio Array AI-14 8-Channel Hybrid USB Audio Mixer with 8 Analog + 2 Digital Inputs, 48kHz/16-Bit Processing, +50dB Gain, Combo XLR, Phantom Power, Hi-Z, 3-Band EQ, 99 DSP FX, Balanced XLR Output",Audio Array,IN,"₹ 33,045.76",6,₹ 0.00,₹ 0.00,6,
FBA75692,AM-C11,B0B4G1HPL5,"Audio Array AM-C11 XLR/USB Dynamic Podcast Microphone | Built-in Monitoring | One Touch Mute and Volume Control | Premium Metal Build | 2M XLR & USB Cable | Streaming, Gaming, Podcasting, Singing",Audio Array,IN,"₹ 32,027.13",8,₹ 0.00,₹ 0.00,7,
FBA76863,AI-03,B0BPM2T7BQ,"Audio Array AI-03 Professional Sound Card with Bluetooth | Podcast Production Setup with 4 mic input & 4 outputs | +48V phantom power, PC/Mac connectivity | 6-8hr Battery | Streaming, Singing & Gaming",Audio Array,IN,"₹ 29,738.16",9,₹ 0.00,₹ 0.00,8,2
FBA79966,AM-Mix10,B0G53KWRVW,"Audio Array AM-Mix10 10-Channel Hybrid USB Mixer with10 Analog+2 Digital Inputs, 48kHz/16-Bit DSP, Phantom Power, USB-C Powered, AUX Sends, Built-In FX, Balanced XLR Outputs for Live, Studio & Podcast",Audio Array,IN,"₹ 27,963.57",3,₹ 0.00,₹ 0.00,3,
FBA79972,M8,B0GCP1J2HC,"Audio Array M8 Latest 2026 Edition 8-Channel Hybrid USB Summing Mixer (6 Analog + 2 Digital) for Recording & Live, 192kHz/24-Bit OTG, 99 DSP FX, 4 XLR Mic Inputs, Phantom Power, Hi-Z & Monitoring",Audio Array,IN,"₹ 27,115.24",4,₹ 0.00,₹ 0.00,4,2
FBA79446,AM-W33,B0DFMMTWLY,"Audio Array AM-W33 UHF Metal Solo Wireless Microphone Set | Built-in Rechargeable Battery | 6–8 Hours Backup | 50M Range | Karaoke, Wedding, DJ, Church | PA System, Amplifier, Mixer, Party Box",Audio Array,IN,"₹ 27,105.06",16,₹ 0.00,₹ 0.00,16,4
FBA79840,AH-60 RD,B0FQBWV1ST,"Audio Array AH-60-RD Semi-Open Back DJ Headphones | 50mm Drivers Delivers Dynamic Balanced Output | 15Hz–25kHz, 32Ω, 100dB SPL, 1200mW | 3m OFC Single-Sided Cable with Screw-On 3.5mm + 6.3mm Plug",Audio Array,IN,"₹ 26,759.35",16,₹ 0.00,₹ 0.00,16,3
FBA79815,AM-W19,B0FPR7VFCH,"Audio Array AM-W19 Wireless Lavalier Microphone|192kHz/24bit |AI Noise Cancellation for iPhone/Android, 32h Charging Case, Plug & Play for Vlogging, Streaming, Meetings, Video Recording",Audio Array,IN,"₹ 25,865.03",17,₹ 0.00,₹ 0.00,17,2
FBA75678,AA-01,B0B4G8PH2P,"Audio Array AA-01 Suspension Boom Scissor Microphone Stand | Double Layer Mesh Pop Filter | 70cm Sturdy Boom Arm with 1.8kg Capacity | 5/8"" to 3/8"" Screw Adapter | Mic Holder, Foam Cover, Cable Ties",Audio Array,IN,"₹ 25,496.61",14,₹ 0.00,₹ 0.00,14,3
FBA79783,AM-C47,B0FF9R3GKK,"Audio Array AM-C47 RGB USB Condenser Mic Kit | AI Noise Cancellation, 192kHz/24Bit Studio Quality, Touch Control, Headphone Monitoring | Podcasting, YouTube, Gaming & Streaming | Mac/PC & Mobile",Audio Array,IN,"₹ 25,288.17",10,₹ 0.00,₹ 0.00,11,5
FBA76597,AA-06,B0BQ7H7418,"Audio Array AA-06 Microphone Boom Arm with 35cm+35cm=70cm Adjustable Suspension Scissor Arm Stand, Shock Mount, Base Clamp, Pop-Filter, 3/8"" to 5/8"" Universal Screw Adapter, 4x Cable Ties",Audio Array,IN,"₹ 25,233.03",23,₹ 0.00,₹ 0.00,22,3
FBA79958,AM-W24,B0G3Q59X8C,"Audio Array AM-W24 Magnetic Wireless 5gm Mic with Flip Charging Case for iPhone/Android/iPad, AI Noise Reduction, 30H Battery, 200ft Range, Plug & Play for Recording Vlogging, Streaming, Meetings",Audio Array,IN,"₹ 25,193.19",16,₹ 0.00,₹ 0.00,16,6
FBA79842,AM-C48,B0G4DNF8RZ,"Audio Array AM-C48 XLR/USB Professional Full RGB Dynamic Microphone Kit | AI Noise Cancellation | Touch & Knob Controls | Built-in Headphone Monitoring | Podcasting, Recording, Streaming, YouTube",Audio Array,IN,"₹ 23,552.53",8,₹ 0.00,₹ 0.00,8,2
FBA79833,PB-04 (AI-04 Red + AM-C44 x 2),B0FJ8PZ9H7,"Audio Array Pro Podcasting Bundle | Audio Interface with 48V Phantom Power & Dual USB/XLR Touch-Control Mics | 192kHz/24bit, Mute, Monitor, Volume Control | Recording, Streaming & Podcasting - PB-04",Audio Array,IN,"₹ 22,784.75",2,₹ 0.00,₹ 0.00,2,1
FBA79826,PB-02 (AI-04 Red + AM-C11 + AA-05),B0FJ2LQT7K,"Audio Array Complete Podcast Bundle | USB/XLR Dynamic Mic with Audio Interface 24bit/192kHz & Boom Arm Stand | Professional Streaming & Recording Kit for PC, Mac & Mobile Devices - PB-02",Audio Array,IN,"₹ 22,780.50",3,₹ 0.00,₹ 0.00,3,2
FBA79960,AM-W47 Wireless,B0G3B152FR,"Audio Array Wireless Voice Amplifier 2026 Edition | Bluetooth 5.3 |10W Speaker With Wireless Mic | For Teachers, Tour Guides |10 Hrs Battery Life |1 Click Monitoring | TWS Connectivity AM-W47 Wireless",Audio Array,IN,"₹ 22,022.87",13,₹ 0.00,₹ 0.00,13,1
FBA75683,AA-03,B0B4G94VP3,"Audio Array AA-03 Double Layer Professional Pop Filter | Flexible 360° Free Angle Adjustable, Durable Windshield | Metal Gooseneck Stabilizing Arm Holder with 32cm Arm Length | Suitable for Recording.",Audio Array,IN,"₹ 20,703.33",49,₹ 0.00,₹ 0.00,47,2
FBA79844,PB-08 (AM-C1 + AI-04),B0FN7DYB2M,"Audio Array Podcast Bundle with USB Condenser Mic Kit, Audio Interface |192kHz/24bit Studio Quality, Plug & Play, Phantom Power, Real-Time Monitoring for Recording, Streaming & Podcasting - PB-08",Audio Array,IN,"₹ 18,047.47",3,₹ 0.00,₹ 0.00,3,3
FBA78974,AA-20,B0CF5RRTDJ,"Audio Array AA-20 Microphone Arm Stand | 81cm Reach | Premium light weight & slick design | Flexible height & position adjustments | 1kg Weight Capacity | 5/8"" to 3/8"" Screw Adapter | Cable Ties",Audio Array,IN,"₹ 17,830.51",10,₹ 0.00,₹ 0.00,10,2
FBA79963,AM-Mix8,B0G53CB72D,"Audio Array AM-Pro8 8-Channel Hybrid USB Mixer 8 Analog+2 Digital Inputs, 48kHz/16-Bit, Built-In Compressor, 6AUX Sends, Group Buses, Insert Points,+24dBu Balanced Outputs for Live, Studio & Broadcast",Audio Array,IN,"₹ 17,795.76",1,₹ 0.00,₹ 0.00,1,
FBA79016,AM-C3a,B0CH4R1V6S,"Audio Array AM-C3a Unidirectional Dynamic Handheld Karaoke Microphone | 20Hz - 20kHz Response | Karaoke Singing, Public Meetings, Studio Recording, Live Sound, Party (no Cable Included)",Audio Array,IN,"₹ 17,211.03",27,₹ 0.00,₹ 0.00,28,11
FBA79820,AC-3XL,B0FQJWWDVK,"Audio Array AC-3XL Mic Cable 6.35mm Jack Male to XLR 3PIN Female Cord Wire | Microphone/Guitar Cable | Black, 1pc Pack (3 Meter/10 Feet)",Audio Array,IN,"₹ 17,122.81",45,₹ 0.00,₹ 0.00,44,2
FBA75689,AM-W13,B0B4G59Y8W,"Audio Array AM-W13 UHF Wireless Premium Metal Microphone | 4+ Hours Receiver Battery Backup | Range up to 60m | Karaoke Singing, Wedding, DJ | Compatible with PA System, Amplifier, Mixer, Party Box",Audio Array,IN,"₹ 16,938.13",10,₹ 0.00,₹ 0.00,10,2
FBA78961,AM-C40,B0CBCB9S14,"Audio Array AM-C40 Large Diaphragm USB Condenser Microphone Kit | Boom Arm & Pop-Filter | 96kHz/24bit No Latency Headphone Monitoring with Mute & Volume Control Knob | Singing, Podcasting & Streaming",Audio Array,IN,"₹ 16,736.45",8,₹ 0.00,₹ 0.00,7,1
FBA79356,AA-19WL,B0D3Q2T5XX,Audio Array AA-19WL RGB Low Profile Boomarm Stand with Riser | 71cm reach & 20 RGB lighting effects & Built-In Cable Management | Matte finish with Flexible adjustments | 2Kg Weight Capacity | White,Audio Array,IN,"₹ 16,227.96",4,₹ 0.00,₹ 0.00,4,
FBA79010,AM-C42,B0CH4T2BJD,"Audio Array AM-C42 Plug & Play AI Noise Cancelling USB Condenser Microphone | Mute Button/Echo/Volume Knob | Kit with Boom Arm & Pop Filter | Karaoke, Gaming, Streaming, Podcast | Mac/PC/Mobile",Audio Array,IN,"₹ 15,759.34",8,₹ 0.00,₹ 0.00,9,2
FBA79448,AM-W35,B0DFMKY4TT,"Audio Array AM-W35 UHF Dual Wireless Premium Karaoke Microphones | 800mah 5-6 Hours Battery Backup | Range up to 50M | Karaoke Singing, Wedding, DJ, Church | PA System, Amplifier, Mixer, Party Box",Audio Array,IN,"₹ 15,097.46",5,₹ 0.00,₹ 0.00,5,3
FBA79965,AM-Mix6,B0G53PRM34,"Audio Array AM-Mix6 6-Channel Hybrid USB Audio Mixer with 6 Analog + 2 Digital Inputs, 48kHz/16-Bit, +50dB Mic Gain, PAD Switch, Dual AUX Sends,128 DSP FX, Balanced XLR Main Output, ≥102dB Max SPL",Audio Array,IN,"₹ 14,405.08",2,₹ 0.00,₹ 0.00,2,
FBA79962,AM-Mix4 OTG,B0G53LZNY3,"Audio Array AM-Mix4 OTG 4-Channel 3 Out Hybrid USB Summing Audio Mixer (4 Analog + 2 Digital), 192kHz/24-Bit OTG, 99 DSP FX, Logarithmic Faders, Balanced XLR Out, Phantom Power, Hi-Z, 3-Band EQ",Audio Array,IN,"₹ 13,980.51",3,₹ 0.00,₹ 0.00,3,1
FBA79708,SB-01,B0FFB6YJM1,"Audio Array SB-01 | Bluetooth Soundbar 25W, Gaming RGB Lights, AUX, Bluetooth, USB, FM & TWS I Fast Charge Battery, Multiport Connectivity, BT Speaker for TV, Mobile, PC, Laptops, Tablets Black",Audio Array,IN,"₹ 13,205.93",12,₹ 0.00,₹ 0.00,12,3
FBA79846,AM-C11X Pro,B0FN7C25VS,"Audio Array AM-C11X Pro XLR Podcast Mic Kit with Dynamic Microphone, 2m XLR Cable & Adjustable Boom Arm | Studio-Quality Sound, 20Hz–20kHz, All-Metal Build for Podcasting, Streaming & Recording",Audio Array,IN,"₹ 12,978.72",4,₹ 0.00,₹ 0.00,4,1
FBA79107,AM-W17,B0CM9P5CCK,"Audio Array AM-W17 Dual Wireless Lapel Mic|in-Built ANC, Plug N Play,Long Battery Life, Ultra-Low Latency,Upto 30M Range|Compatible with iPhone & Android|Vlogging, Streaming, Teaching,YouTube, Black",Audio Array,IN,"₹ 12,722.15",9,₹ 0.00,₹ 0.00,9,5
FBA79957,AM-W23,B0G3Q517Y2,"Audio Array AM-W23 Magnetic Wieless Mic with Charging Pouch 2026 Edition 24Bit/ 48Khz, iPhone/Android/iPad/Laptop, AI Noise Reduction, 50H Battery, 230ft Range for Recording, Vlogging",Audio Array,IN,"₹ 12,707.63",5,₹ 0.00,₹ 0.00,4,
FBA79959,AM-W47 Wired,B0G39ZHDYP,"Audio Array Wired Voice Amplifier 2026 Edition | Bluetooth 5.3 | Wired Headset Mic with 10W Speaker for Teachers, Tour Guides | 10Hrs Battery Life |1 Click Monitoring | TWS Connectivity AM-W47 Wired",Audio Array,IN,"₹ 12,217.78",12,₹ 0.00,₹ 0.00,11,9
FBA79064,AA-25,B0CJR76Y7G,"Audio Array AA-25 Handheld Microphone Interview Adapter for Wireless Lapel Microphones | Supports, Rode Go, DJI, Hollyland mics etc | Foam Cover with Built-in Cold Shoe Mount",Audio Array,IN,"₹ 12,157.63",18,₹ 0.00,₹ 0.00,18,8
FBA79108,AM-W16,B0CM9L1QZG,"Audio Array AM-W16 Solo Wireless Lapel Over Ear Mic|in-Built ANC,Plug N Play,LongBattery Life,Ultra-Low Latency,Upto 30M Range|Compatible with iPhone&Android|Vlogging,Streaming,Teaching,YouTube,Black",Audio Array,IN,"₹ 11,780.62",12,₹ 0.00,₹ 0.00,12,2
FBA75680,AM-C6,B0B4G1PXWV,"Audio Array AM-C6 USB Plug & Play Condenser Microphone Kit | with pop-Filter & Shock Mount | 3.5 mm No Latency Monitoring, Volume Control & Mute Button | Gaming, Podcasting & Streaming",Audio Array,IN,"₹ 11,453.41",7,₹ 0.00,₹ 0.00,6,1
FBA75691,AM-W14,B0B4G5JG4P,"Audio Array AM-W14 UHF Dual Wireless Premium Metal Microphone | 2X XLR Outs & 1/4"" Mix Out | Range up to 200ft/60m | Karaoke Singing, Wedding, DJ, Church | PA System, Amplifier, Mixer, Party Box",Audio Array,IN,"₹ 11,015.26",2,₹ 0.00,₹ 0.00,1,
FBA79653,AM-C45 Pro,B0DN6LJZBR,"Audio Array AM-C45 XLR/USB Pro RGB Dynamic Microphone Kit | 192kHz/24bit Studio Quality Output | Volume Control, Mute and Noise Cancellation | Realtime Monitoring for Streaming, Gaming & podcasting",Audio Array,IN,"₹ 10,421.19",3,₹ 0.00,₹ 0.00,3,
FBA79447,AM-W34,B0DFMLXD9S,"Audio Array AM-W34 UHF Dual Wireless Premium Metal Microphones | 800mAh 6-8 Hours Receiver Battery Backup | Range up to 50M | Karaoke Singing, Wedding, Church | PA System, Amplifier, Mixer, Party Box",Audio Array,IN,"₹ 10,166.94",3,₹ 0.00,₹ 0.00,3,2
FBA79825,GB-02 (AM-C43 + AI-11),B0FJ2DT13L,"Audio Array All in 1 Pro Bundle | Condenser Mic with USB Bluetooth Soundcard Mixer | Complete Setup for Streaming, Podcasting, Gaming, Singing & Home Studio Recording - GB-02",Audio Array,IN,"₹ 9,912.72",3,₹ 0.00,₹ 0.00,3,1
FBA75686,AM-W10,B0B4G89VQJ,"Audio Array AM-W10 Professional Dual Wireless Lapel Mics | Upto 10hr Battery & 100m Range | 2X Lapel mics, Type C Adapter for Easy Plug&Play | Volume & Mute Function | Vlogging, Streaming, YouTube",Audio Array,IN,"₹ 9,572.04",3,₹ 0.00,₹ 0.00,3,
FBA79824,GB-01 (AM-C43 +AI-10),B0FJ2K95XT,"Audio Array Ultimate Gaming Bundle | Condenser Mic with Boom Arm & Sound Card | Streaming Kit for PC/Mobile with 14 FX, Voice Modes, Loopback, Real Time Monitoring |for YouTube & Live Stream - GB-01",Audio Array,IN,"₹ 9,416.95",2,₹ 0.00,₹ 0.00,2,
FBA75676,AM-C4,B0B4DS678Q,"Audio Array AM-C4 USB Plug & Play Condenser Microphone with Tripod, Pop-Filter & Shock Mount | for Conference, Gaming, Podcasting, Voice Over, YouTube, Skype, Zoom & Live Streaming on iOS,Windows",Audio Array,IN,"₹ 8,263.54",5,₹ 0.00,₹ 0.00,5,
FBA79832,GB-05 (AM-C43 + AI-06),B0FJ8S53GW,"Audio Array Streaming Bundle Kit | USB Condenser Mic & RGB Sound Card with Phantom Power, Voice Effects, Real-Time Monitoring | for Podcasting, Gaming, YouTube & Live Streaming - GB-05",Audio Array,IN,"₹ 6,667.66",2,₹ 0.00,₹ 0.00,2,
