FBA78424,AM-C37,B0C55MY66L,"Audio Array AM-C37 Premium USB/XLR Dynamic Podcast Microphone | Volume, Mute Controls & Headphone Monitoring | Premium Metal Build | 2 Meter USB Cable Included | 96kHz/24bit Studio Performance",Audio Array,IN,"₹ 5,236.50",2,₹ 0.00,₹ 0.00,2,2
FBA79822,KB-01 (AM-W32 + AI-12),B0FJ2J6MTF,"Audio Array Portable Karaoke Bundle | Dual Wireless UHF Microphones with Rechargeable Battery Receiver & USB Plug n Play BT Soundcard Mixer | Ideal for Parties, Home Karaoke & Live Singing - KB-01",Audio Array,IN,"₹ 4,236.44",1,₹ 0.00,₹ 0.00,1,
FBA76723,AM-C20,B0BLKF46QG,"Audio Array AM-C20 USB Microphone | Unique Tilt Stand & one Touch Mute | Plug n Play, No Latency Cardioid Pickup | for PC, Smartphones, iOS | Gaming, Streaming, Podcasts, Twitch, YouTube, Discord",Audio Array,IN,"₹ 3,429.66",3,₹ 0.00,₹ 0.00,3,2
FBA79830,GB-03 (AI-12 + AM-C43),B0FJ8TSQK1,"Audio Array Singing Bundle | Condenser Mic with Boom Arm & Sound Card V8 | Voice Effects, Reverb, Bluetooth | Ideal for Podcasting, Karaoke, Live Streaming, YouTube & Singing - GB-03",Audio Array,IN,"₹ 3,219.49",1,₹ 0.00,₹ 0.00,1,
FBA79009,AM-C41,B0CH4PMR8K,"Audio Array AM-C41 Plug & Play AI Noise Cancellation USB Condenser Microphone | Mute Button/Echo/Volume Knob | Kit with Tripod, Mic Cover | Gaming, Streaming, Podcast | Mac/PC/Laptop/Mobile",Audio Array,IN,"₹ 2,761.02",2,₹ 0.00,₹ 0.00,2,1
FBA79722,AM-W21,B0F2HYY7JF,"Audio Array AM-W21 Dual Wireless Lapel Mic | TFT Card Recording, Noise Cancellation & Echo | Android, iOS, DSLR Camera, Laptops | 360° Pickup, Plug n Play, 60M Working Range, 48-Hour Battery Life",Audio Array,IN,"₹ 2,572.04",1,₹ 0.00,₹ 0.00,1,
FBA79465,AM-W21,B0DFMQCGT1,"Audio Array AM-W21 Wireless Microphone Kit | Built in Recording, Noise Reduction & Echo | Smartphones, Cameras, Laptops | Dual-Channel Recording, 200 feet Transmission Range, 48-Hour Battery Life",Audio Array,IN,"₹ 2,134.17",1,₹ 0.00,₹ 0.00,1,
FBA78203,AM-C30,B0C4YTNJG7,"Audio Array AM-C30 Metal RGB Professional USB Microphone | One-Touch Mute, Gain & No-Latency Monitoring Controls | Shock Mount and Tripod | for PC/Mobile, Gaming, Streaming, Podcasting & Voiceover",Audio Array,IN,"₹ 1,694.06",1,₹ 0.00,₹ 0.00,1,2
FBA79905,PB-11 (AM-C44+AA-05+AH-45-BK),B0FTVSH458,"Audio Array Professional Dynamic Studio Bundle with Headphones – USB/XLR Dynamic Microphone, Boom Arm, Monitoring Headphones | 24-bit/192kHz, Plug & Play, No-Latency Recording, Monitoring - PB-11",Audio Array,IN,₹ 0.00,0,,,,
FBA77010,AI-04 Black,B0BPMBMN3S,Audio Array AI-04 2x2 Audio Interface | Premium Mic Pre-Amps | 48V Phantom Power Support | 24-bit/192kHz High Fidelity Recording | XLR/MIC/LINE inputs | Plug and Play-No Drivers | Metal Body | Black,Audio Array,IN,₹ 0.00,0,,,,
FBA79008,AI-06,B0CH4RT4P8,"Audio Array AI-06 Streaming Audio Mixer Sound Card | XLR, 1/4"" & line in | PC/Phone RGB Mixer with Volume Fader, Individual Control, Mute and Monitoring, 48V Phantom Power | Stream, Podcast & Karaoke",Audio Array,IN,₹ 0.00,0,,,,1
FBA78204,AM-C31,B0C4YT43Z3,"Audio Array AM-C31 USB Plug & Play Condenser Microphone Kit | Pop-Filter & Metallic Base | 3.5 mm No Latency Monitoring, Volume Control & Mute Button | for PC/Mobile, Gaming, Podcasting & Streaming",Audio Array,IN,₹ 0.00,0,,,,
FBA79835,PB-06 (AA-05 + AM-C44 + AI-04),B0FJ8TWCQZ,"Audio Array Pro Podcast Bundle | USB/XLR Dynamic Microphone with 24-Bit/192kHz Audio Interface & Boom Arm | Real-Time Monitoring, Plug & Play for Streaming, Recording & Content Creation - PB-06",Audio Array,IN,₹ 0.00,0,₹ 0.00,₹ 0.00,1,1
FBA79230,AM-W46,B0CX1XK5R6,Audio Array AM-W46 Groove Wireless Bluetooth 5.3 Bookshelf Speaker 30W | 5400mAh upto 24h Long Battery | 3 EQ Modes | Stylish Premium Metal Body | Superior Bass Quality,Audio Array,IN,₹ 0.00,0,,,,
FBA76730,AM-C27,B0BLKB6FRR,"Audio Array AM-C27 XLR to TRS Cardioid Dynamic Handheld Microphone Sound for Live Events | Premium Built with 4.5M Cable | Singing, Public Meetings, Studio Recording, Live Sound, Party",Audio Array,IN,₹ 0.00,0,,,,
